{
  "spec_version": "1.0",
  "strategy_id": "manual_pool_top2_runtime_compat",
  "strategy_name": "Manual Pool Top-2 Runtime Compatibility Example",
  "strategy_type": "stock_selection",
  "asset_class": "stock",
  "target_platforms": [
    "quantstudio",
    "ptrade-default"
  ],
  "contract_versions": {
    "strategy_spec_version": "1.0.0",
    "engine_semantics_version": "0.4.0-next-open-basket",
    "provider_contract_version": "0.2.0-frequency-aware",
    "security_code_rules_version": "1.0.0",
    "ptrade_profile_version": "1.0.0-default",
    "renderer_version": "0.3.2-mvp",
    "skill_version": "0.3.2-mvp"
  },
  "time_model": {
    "market_data_frequency": "1d",
    "factor_frequency": "1d",
    "signal_frequency": "1d",
    "decision_clock": "bar_close",
    "execution_clock": "next_open",
    "portfolio_valuation_frequency": "1d",
    "holding_period_unit": "trading_day",
    "signal_data_cutoff": "T-close"
  },
  "engine_profile": {
    "profile_id": "daily-bar-v1",
    "event_type": "bar",
    "bar_frequency": "1d",
    "market_depth": "L1",
    "order_book_levels": 0,
    "schema_supported": true,
    "execution_status": "READY"
  },
  "universe": {
    "kind": "manual_list",
    "parameters": {
      "codes": [
        "600570.SH",
        "000001.SZ",
        "920001.BJ"
      ]
    }
  },
  "hard_filters": {
    "exclude_st": true,
    "exclude_suspended": true,
    "exclude_delisted": true,
    "exclude_delisting_sorting": true,
    "exclude_star_market": true,
    "exclude_bse": false,
    "min_listing_trade_days": 0,
    "exclude_invalid_price": true,
    "exclude_zero_volume": true,
    "block_limit_up_buy": true,
    "block_limit_down_sell": true,
    "enforce_t1": true,
    "round_lot": 100
  },
  "signals": {
    "steps": [
      {
        "id": "return_2d",
        "operation": "pct_change",
        "parameters": {
          "field": "close",
          "lookback": 2
        }
      },
      {
        "id": "top2_by_return_2d",
        "operation": "top_n",
        "parameters": {
          "source": "return_2d",
          "top_n": 2,
          "ascending": false
        }
      }
    ]
  },
  "portfolio": {
    "kind": "equal_weight_top_n",
    "parameters": {
      "max_positions": 2,
      "rebalance": "daily",
      "target_weight": 0.5
    }
  },
  "execution": {
    "mode": "native",
    "match_price_mode": "next_open",
    "order_type": "market",
    "allow_partial_fill": false
  },
  "risk": {
    "kind": "position_limits",
    "parameters": {
      "max_single_weight": 0.5,
      "max_positions": 2,
      "cash_buffer": 0.0
    }
  },
  "costs": {
    "commission_rate": 0.0003,
    "minimum_commission": 5.0,
    "stamp_tax_rate": 0.0005,
    "transfer_fee_rate": 1e-05,
    "slippage_bps": 0.0
  },
  "data_requirements": {
    "datasets": [
      {
        "dataset": "stock_daily",
        "frequency": "1d",
        "fields": [
          "close",
          "open",
          "volume",
          "suspendFlag",
          "isST",
          "is_delisting_risk"
        ],
        "required": true,
        "pit_required": false
      }
    ]
  },
  "capability_requirements": [
    "stock_daily_backtest",
    "stock_status_filter",
    "quantstudio_public_api",
    "ptrade_default_public_api"
  ],
  "approximations": [],
  "user_confirmations": [
    {
      "confirmation_id": "spec_review",
      "status": "CONFIRMED",
      "note": "Runtime compatibility regression fixture."
    }
  ],
  "validation_policy": {
    "no_lookahead": "BLOCK",
    "hard_filters": "BLOCK",
    "strict_public_api": true,
    "smoke_backtest": "WHEN_READY"
  },
  "output": {
    "root": "output/generated_strategies",
    "overwrite": false
  }
}
